{
  "$schema": "http://json-schema.org/draft-07/schema#",
  "$id": "https://data.quipsapp.com/schema/collection.schema.json",
  "title": "Quips collection file",
  "description": "Shape of a single collections/<id>.json file. Enforced in CI by scripts/validate_collections.py, which performs additional cross-file checks this schema cannot express.",
  "type": "object",
  "required": ["id", "name", "description", "author", "colorName", "iconName", "category", "addedAt", "lastUpdated", "quotes"],
  "additionalProperties": true,
  "properties": {
    "id": { "type": "string", "pattern": "^[a-z0-9-]+$" },
    "name": { "type": "string", "minLength": 1 },
    "description": { "type": "string" },
    "author": { "type": "string" },
    "colorName": { "type": "string" },
    "colorLightHex": { "type": "string", "pattern": "^#[0-9A-Fa-f]{6}$", "description": "Light-appearance hex for colorName's Palette 2.0 token. Cross-platform clients use this pair; iOS prefers colorName when present." },
    "colorDarkHex": { "type": "string", "pattern": "^#[0-9A-Fa-f]{6}$", "description": "Dark-appearance hex for colorName's Palette 2.0 token." },
    "iconName": { "type": "string" },
    "category": { "type": "string" },
    "tags": {
      "type": "array",
      "maxItems": 8,
      "uniqueItems": true,
      "items": { "type": "string", "pattern": "^[a-z0-9-]+$" },
      "description": "Optional: the slugs most characteristic of this collection as a whole, for browse-by-tag. Not consumed by import, which reads each quote's own tags."
    },
    "addedAt": { "type": "string", "pattern": "^\\d{4}-\\d{2}-\\d{2}T\\d{2}:\\d{2}:\\d{2}Z$", "description": "ISO-8601 UTC timestamp of when this collection first entered the dataset. Powers recency-based dynamic collections (e.g. Recently Added)." },
    "lastUpdated": { "type": "string", "pattern": "^\\d{4}-\\d{2}-\\d{2}T\\d{2}:\\d{2}:\\d{2}Z$" },
    "quotes": {
      "type": "array",
      "items": { "$ref": "#/definitions/quote" }
    }
  },
  "definitions": {
    "quote": {
      "type": "object",
      "required": ["id", "content", "authorName", "source", "verificationStatus", "notes", "addedAt"],
      "additionalProperties": true,
      "properties": {
        "id": { "type": "string", "pattern": "^[a-z0-9]+-\\d{3,}$" },
        "content": { "type": "string", "minLength": 1 },
        "authorName": { "type": "string" },
        "source": { "type": "string" },
        "notes": { "type": "string" },
        "verificationStatus": {
          "type": "string",
          "enum": ["verified", "attributed", "unverified", "folk-wisdom"]
        },
        "sourceType": {
          "type": "string",
          "enum": [
            "unspecified", "inPerson", "book", "article", "newspaper", "magazine",
            "comic", "movie", "television", "podcast", "radio", "song", "speech",
            "interview", "website", "socialMedia", "video", "game", "letter", "poem",
            "play", "lecture", "documentary"
          ]
        },
        "quoteDate": { "type": "string" },
        "tags": {
          "type": "array",
          "maxItems": 6,
          "uniqueItems": true,
          "items": { "type": "string", "pattern": "^[a-z0-9-]+$" },
          "description": "Controlled-vocabulary tag slugs from schema/tags.json, ordered most-specific-first. The ordering is the ranking: bulk import applies only the leading few, so put the tag that most distinguishes this quote first. At least one must be a 'theme' tag. validate_collections.py rejects unknown slugs."
        },
        "addedAt": { "type": "string", "pattern": "^\\d{4}-\\d{2}-\\d{2}T\\d{2}:\\d{2}:\\d{2}Z$", "description": "ISO-8601 UTC timestamp of when this quote was added to the dataset. A quote added with its collection shares the collection's addedAt." }
      }
    }
  }
}
