{
  "id": "starcraft",
  "name": "StarCraft",
  "description": "Battle cries and unit barks from the Koprulu Sector — the Terran, Protoss, and Zerg lines burned into every RTS player's memory.",
  "author": "Quips Editorial",
  "colorName": "cyan",
  "colorLightHex": "#29ACB2",
  "colorDarkHex": "#2DD3DA",
  "iconName": "bolt.fill",
  "category": "Video Games",
  "addedAt": "2026-07-01T14:52:27Z",
  "lastUpdated": "2026-07-01T12:00:00Z",
  "quotes": [
    {
      "id": "scraft-001",
      "content": "You must construct additional pylons.",
      "authorName": "Adjutant (StarCraft)",
      "source": "StarCraft, Blizzard Entertainment (1998)",
      "quoteDate": "1998",
      "verificationStatus": "verified",
      "sourceType": "game",
      "notes": "The Protoss supply warning that became one of gaming's most-quoted catchphrases.",
      "tags": [],
      "addedAt": "2026-07-01T14:52:27Z"
    },
    {
      "id": "scraft-002",
      "content": "Nuclear launch detected.",
      "authorName": "Adjutant (StarCraft)",
      "source": "StarCraft, Blizzard Entertainment (1998)",
      "quoteDate": "1998",
      "verificationStatus": "verified",
      "sourceType": "game",
      "notes": "The dreaded Terran alert that a Ghost has armed a nuclear strike somewhere on the map.",
      "tags": [],
      "addedAt": "2026-07-01T14:52:27Z"
    },
    {
      "id": "scraft-003",
      "content": "Insufficient vespene gas.",
      "authorName": "Adjutant (StarCraft)",
      "source": "StarCraft, Blizzard Entertainment (1998)",
      "quoteDate": "1998",
      "verificationStatus": "verified",
      "sourceType": "game",
      "notes": "The resource warning heard by every player who over-extended their build order.",
      "tags": [],
      "addedAt": "2026-07-01T14:52:27Z"
    },
    {
      "id": "scraft-004",
      "content": "Additional supply depots required.",
      "authorName": "Adjutant (StarCraft)",
      "source": "StarCraft, Blizzard Entertainment (1998)",
      "quoteDate": "1998",
      "verificationStatus": "verified",
      "sourceType": "game",
      "notes": "The Terran counterpart to the Protoss pylon warning.",
      "tags": [],
      "addedAt": "2026-07-01T14:52:27Z"
    },
    {
      "id": "scraft-005",
      "content": "My life for Aiur!",
      "authorName": "Zealot (StarCraft)",
      "source": "StarCraft, Blizzard Entertainment (1998)",
      "quoteDate": "1998",
      "verificationStatus": "verified",
      "sourceType": "game",
      "notes": "The Protoss Zealot's battle cry, invoking their homeworld of Aiur.",
      "tags": [
        "sacrifice",
        "loyalty",
        "one-liner"
      ],
      "addedAt": "2026-07-01T14:52:27Z"
    },
    {
      "id": "scraft-006",
      "content": "Battlecruiser operational.",
      "authorName": "Battlecruiser (StarCraft)",
      "source": "StarCraft, Blizzard Entertainment (1998)",
      "quoteDate": "1998",
      "verificationStatus": "verified",
      "sourceType": "game",
      "notes": "The selection response of the Terran capital ship.",
      "tags": [],
      "addedAt": "2026-07-01T14:52:27Z"
    },
    {
      "id": "scraft-007",
      "content": "You wanna piece of me, boy?",
      "authorName": "Marine (StarCraft)",
      "source": "StarCraft, Blizzard Entertainment (1998)",
      "quoteDate": "1998",
      "verificationStatus": "verified",
      "sourceType": "game",
      "notes": "The Terran Marine's cocky selection line.",
      "tags": [],
      "addedAt": "2026-07-01T14:52:27Z"
    },
    {
      "id": "scraft-008",
      "content": "Rock and roll!",
      "authorName": "Marine (StarCraft)",
      "source": "StarCraft, Blizzard Entertainment (1998)",
      "quoteDate": "1998",
      "verificationStatus": "verified",
      "sourceType": "game",
      "notes": "The Marine's order-acknowledgment when sent into battle.",
      "tags": [],
      "addedAt": "2026-07-01T14:52:27Z"
    },
    {
      "id": "scraft-009",
      "content": "Ready to work.",
      "authorName": "SCV (StarCraft)",
      "source": "StarCraft, Blizzard Entertainment (1998)",
      "quoteDate": "1998",
      "verificationStatus": "verified",
      "sourceType": "game",
      "notes": "The Terran SCV's selection response.",
      "tags": [],
      "addedAt": "2026-07-01T14:52:27Z"
    },
    {
      "id": "scraft-010",
      "content": "I'm a little busy right now.",
      "authorName": "SCV (StarCraft)",
      "source": "StarCraft, Blizzard Entertainment (1998)",
      "quoteDate": "1998",
      "verificationStatus": "verified",
      "sourceType": "game",
      "notes": "One of the SCV's repeated-click lines.",
      "tags": [],
      "addedAt": "2026-07-01T14:52:27Z"
    },
    {
      "id": "scraft-011",
      "content": "Somebody call for an exterminator?",
      "authorName": "Ghost (StarCraft)",
      "source": "StarCraft, Blizzard Entertainment (1998)",
      "quoteDate": "1998",
      "verificationStatus": "verified",
      "sourceType": "game",
      "notes": "The Terran Ghost's selection line, alluding to their covert kill role.",
      "tags": [],
      "addedAt": "2026-07-01T14:52:27Z"
    },
    {
      "id": "scraft-012",
      "content": "Need a light?",
      "authorName": "Firebat (StarCraft)",
      "source": "StarCraft, Blizzard Entertainment (1998)",
      "quoteDate": "1998",
      "verificationStatus": "verified",
      "sourceType": "game",
      "notes": "The flamethrower-wielding Firebat's selection quip.",
      "tags": [],
      "addedAt": "2026-07-01T14:52:27Z"
    },
    {
      "id": "scraft-013",
      "content": "Where does it hurt?",
      "authorName": "Medic (StarCraft: Brood War)",
      "source": "StarCraft: Brood War, Blizzard Entertainment (1998)",
      "quoteDate": "1998",
      "verificationStatus": "verified",
      "sourceType": "game",
      "notes": "The Terran Medic, added in the Brood War expansion, on selection.",
      "tags": [],
      "addedAt": "2026-07-01T14:52:27Z"
    },
    {
      "id": "scraft-014",
      "content": "Let's ride!",
      "authorName": "Vulture (StarCraft)",
      "source": "StarCraft, Blizzard Entertainment (1998)",
      "quoteDate": "1998",
      "verificationStatus": "verified",
      "sourceType": "game",
      "notes": "The hover-bike Vulture rider's order response.",
      "tags": [],
      "addedAt": "2026-07-01T14:52:27Z"
    },
    {
      "id": "scraft-015",
      "content": "En Taro Adun!",
      "authorName": "Dragoon (StarCraft)",
      "source": "StarCraft, Blizzard Entertainment (1998)",
      "quoteDate": "1998",
      "verificationStatus": "verified",
      "sourceType": "game",
      "notes": "A Protoss battle cry invoking Adun, a revered figure of their history.",
      "tags": [],
      "addedAt": "2026-07-01T14:52:27Z"
    },
    {
      "id": "scraft-016",
      "content": "I have returned!",
      "authorName": "Fenix (StarCraft)",
      "source": "StarCraft, Blizzard Entertainment (1998)",
      "quoteDate": "1998",
      "verificationStatus": "verified",
      "sourceType": "game",
      "notes": "The Protoss hero Fenix's line after being resurrected as a Dragoon.",
      "tags": [],
      "addedAt": "2026-07-01T14:52:27Z"
    },
    {
      "id": "scraft-017",
      "content": "For Adun!",
      "authorName": "Zealot (StarCraft)",
      "source": "StarCraft, Blizzard Entertainment (1998)",
      "quoteDate": "1998",
      "verificationStatus": "verified",
      "sourceType": "game",
      "notes": "A Protoss war cry given when ordered into battle.",
      "tags": [],
      "addedAt": "2026-07-01T14:52:27Z"
    },
    {
      "id": "scraft-018",
      "content": "Ready to roll out!",
      "authorName": "Siege Tank (StarCraft)",
      "source": "StarCraft, Blizzard Entertainment (1998)",
      "quoteDate": "1998",
      "verificationStatus": "verified",
      "sourceType": "game",
      "notes": "The Terran Siege Tank's selection response.",
      "tags": [],
      "addedAt": "2026-07-01T14:52:27Z"
    },
    {
      "id": "scraft-019",
      "content": "I will rule this sector or see it burnt to ashes around me.",
      "authorName": "Arcturus Mengsk (StarCraft)",
      "source": "StarCraft, Blizzard Entertainment (1998)",
      "quoteDate": "1998",
      "verificationStatus": "verified",
      "sourceType": "game",
      "notes": "The Terran Dominion's founder revealing the depth of his ambition.",
      "tags": [
        "power",
        "pride",
        "defiance"
      ],
      "addedAt": "2026-07-01T14:52:27Z"
    },
    {
      "id": "scraft-020",
      "content": "Hell, it's about time.",
      "authorName": "Tychus Findlay (StarCraft II: Wings of Liberty)",
      "source": "StarCraft II: Wings of Liberty, Blizzard Entertainment (2010)",
      "quoteDate": "2010",
      "verificationStatus": "verified",
      "sourceType": "game",
      "notes": "The opening cinematic line as Tychus is sealed into his marine armor.",
      "tags": [],
      "addedAt": "2026-07-01T14:52:27Z"
    }
  ]
}
